{
  "schema_version": "1.0",
  "id": "demo-context",
  "model_name": "Demo Context Model",
  "model_variant": "Synthetic in-context demo — not a benchmark result",
  "paper_url": "https://example.test/graphland/demo-context/paper",
  "code_availability": "unavailable",
  "training_code_url": null,
  "submitter_github": "demo-context",
  "provenance": "author_submission",
  "source_issue": 99003,
  "graphland_ref": "v1-demo-fixture",
  "method_type": "in_context",
  "hparam_trials": 0,
  "tuning_protocol": "Synthetic QA fixture: fictional in-context inference with no tuning or model execution.",
  "num_runs": 1,
  "external_data_pretraining": "Synthetic fixture metadata; no real training or evaluation was performed.",
  "submitted_at": "2026-07-12",
  "verification": "self_reported",
  "review": {
    "status": "pending",
    "reviewer_github": null,
    "reviewed_at": null,
    "notes": null
  },
  "notes": "Synthetic UI/QA fixture. These values are not benchmark claims and must never be published as GraphLand results.",
  "results": [
    {
      "setting": "RL",
      "dataset": "pokec-regions",
      "value": 0.591
    },
    {
      "setting": "RL",
      "dataset": "city-reviews",
      "value": 0.623
    },
    {
      "setting": "RL",
      "dataset": "hm-prices",
      "value": -0.231
    },
    {
      "setting": "RH",
      "dataset": "hm-categories",
      "value": 0.803
    },
    {
      "setting": "RH",
      "dataset": "artnet-exp",
      "value": 0.553
    },
    {
      "setting": "RH",
      "dataset": "city-roads-L",
      "value": -0.052
    },
    {
      "setting": "RH",
      "dataset": "web-traffic",
      "value": 0.021
    },
    {
      "setting": "TH",
      "dataset": "web-topics",
      "value": 0.612
    },
    {
      "setting": "TH",
      "dataset": "web-fraud",
      "value": 0.501
    },
    {
      "setting": "TH",
      "dataset": "twitch-views",
      "value": -0.118
    },
    {
      "setting": "THI",
      "dataset": "hm-categories",
      "value": 0.579
    },
    {
      "setting": "THI",
      "dataset": "artnet-views",
      "value": -0.337
    }
  ]
}
