{
  "schema_version": "1.0",
  "id": "demo-delta",
  "model_name": "Demo Delta Ensemble",
  "model_variant": "Synthetic closed-code demo — not a benchmark result",
  "paper_url": "https://example.test/graphland/demo-delta/paper",
  "code_availability": "unavailable",
  "training_code_url": null,
  "submitter_github": "demo-maintainer",
  "provenance": "maintainer_seeded",
  "source_issue": 99004,
  "graphland_ref": "v1-demo-fixture",
  "method_type": "trained",
  "hparam_trials": 6,
  "tuning_protocol": "Synthetic QA fixture: a fictional closed ensemble selected from six validation trials.",
  "num_runs": 4,
  "external_data_pretraining": "Synthetic fixture metadata; no real training or evaluation was performed.",
  "submitted_at": "2026-07-13",
  "verification": "self_reported",
  "review": {
    "status": "approved",
    "reviewer_github": "demo-reviewer",
    "reviewed_at": "2026-07-13",
    "notes": "Synthetic approved UI state only."
  },
  "notes": "Synthetic UI/QA fixture. These values are not benchmark claims and must never be published as GraphLand results.",
  "results": [
    {"setting": "RL", "dataset": "hm-categories", "value": 0.812, "std": 0.004},
    {"setting": "RL", "dataset": "artnet-exp", "value": 0.594, "std": 0.008},
    {"setting": "RL", "dataset": "city-roads-M", "value": 0.044, "std": 0.017},
    {"setting": "RL", "dataset": "city-roads-L", "value": -0.019},
    {"setting": "RH", "dataset": "web-topics", "value": 0.755, "std": 0.006},
    {"setting": "RH", "dataset": "web-fraud", "value": 0.641, "std": 0.009},
    {"setting": "RH", "dataset": "avazu-ctr", "value": 0.208, "std": 0.012},
    {"setting": "TH", "dataset": "pokec-regions", "value": 0.611, "std": 0.011},
    {"setting": "TH", "dataset": "tolokers-2", "value": 0.572},
    {"setting": "TH", "dataset": "artnet-views", "value": -0.041, "std": 0.019},
    {"setting": "THI", "dataset": "artnet-exp", "value": 0.529, "std": 0.014},
    {"setting": "THI", "dataset": "twitch-views", "value": -0.203, "std": 0.033}
  ]
}
